{
  "$schema": "../schema/slovnik.schema.json",
  "name": "Slovník ťažkých slov verejnej správy",
  "description": "Spoločný slovník pre orgány verejnej správy na Slovensku: ťažké slová a ich vysvetlenia v ľahko čitateľnom jazyku. Overovací prototyp. Základ tvoria vysvetlenia z webu Úradu komisára pre osoby so zdravotným postihnutím, upravené tak, aby platili pre každý úrad.",
  "tier": "public",
  "lang": "sk",
  "version": "2026-09-30",
  "updated": "2026-09-30",
  "licence": {
    "name": "CC BY-NC-SA 4.0",
    "url": "https://creativecommons.org/licenses/by-nc-sa/4.0/",
    "attribution": "Slovník ťažkých slov verejnej správy, https://github.com/athelas64/etr-slovnik, CC BY-NC-SA 4.0. Základ: Úrad komisára pre osoby so zdravotným postihnutím, www.komisar.sk.",
    "note": "Licencia je predbežná do rozhodnutia MIRRI. Výskumný projekt zverejnený na účel hodnotenia; pripomienky a žiadosti o stiahnutie obsahu: milan.regec@uniba.sk."
  },
  "domains": [
    "úrad",
    "právo",
    "peniaze",
    "zdravie",
    "sociálne služby",
    "práca",
    "bývanie",
    "vzdelávanie",
    "doprava",
    "digitál",
    "rodina",
    "ostatné"
  ],
  "entries": [
    {
      "id": "komisar-pre-osoby-so-zdravotnym-postihnutim",
      "term": "komisár pre osoby so zdravotným postihnutím",
      "forms": [
        "komisár",
        "komisárka",
        "komisára",
        "komisárovi"
      ],
      "easy": "Komisár pre osoby so zdravotným postihnutím chráni práva ľudí so zdravotným postihnutím.\nSkúma, či niekto porušil vaše práva.\nKomisára zriadil zákon v roku 2015.\nKomisár rozhoduje nezávisle.",
      "domain": "úrad",
      "note": "Komisár je funkcia zriadená zákonom. Úrad komisára je pracovisko, ktoré mu pomáha. Web úradu ich rozlišuje.",
      "source": {
        "name": "Úrad komisára pre osoby so zdravotným postihnutím",
        "url": "https://www.komisar.sk/o-urade",
        "fetched": "2026-09-29",
        "title": "Kto je komisár"
      },
      "status": "draft",
      "origin": "adapted",
      "added": "2026-09-29",
      "contributor": "athelas64"
    },
    {
      "id": "urad-komisara-pre-osoby-so-zdravotnym-postihnutim",
      "term": "Úrad komisára pre osoby so zdravotným postihnutím",
      "forms": [
        "úrad komisára"
      ],
      "easy": "Úrad komisára je pracovisko.\nPomáha komisárovi robiť jeho prácu.\nPracujú tu ľudia, ktorí vybavujú vaše podnety.",
      "domain": "úrad",
      "source": {
        "name": "Úrad komisára pre osoby so zdravotným postihnutím",
        "url": "https://www.komisar.sk/o-urade",
        "fetched": "2026-09-29",
        "title": "Čo je Úrad komisára"
      },
      "status": "draft",
      "origin": "adapted",
      "added": "2026-09-29",
      "contributor": "athelas64"
    },
    {
      "id": "podnet",
      "term": "podnet",
      "forms": [
        "podnety",
        "podať podnet",
        "podanie podnetu"
      ],
      "easy": "Podnet je správa o tom, že niekto porušil práva.\nPodnet môže podať každý.\nZa podanie podnetu nič neplatíte.\nPodnet môžete podať aj bez uvedenia mena.",
      "example": "Napríklad napíšete, že vás úrad nepustil dnu na vozíku.",
      "domain": "úrad",
      "source": {
        "name": "Úrad komisára pre osoby so zdravotným postihnutím",
        "url": "https://www.komisar.sk/pre-verejnost",
        "fetched": "2026-09-29",
        "title": "Ako podať podnet"
      },
      "status": "draft",
      "origin": "adapted",
      "added": "2026-09-29",
      "contributor": "athelas64",
      "updated": "2026-09-29"
    },
    {
      "id": "referat",
      "term": "referát",
      "forms": [
        "referáty"
      ],
      "easy": "Referát je oddelenie úradu.\nKaždý referát sa venuje inej oblasti práv.",
      "example": "Jeden referát rieši peňažné príspevky.\nIný referát rieši zdravotnú starostlivosť.",
      "domain": "úrad",
      "source": {
        "name": "Úrad komisára pre osoby so zdravotným postihnutím",
        "url": "https://www.komisar.sk/cinnosti-komisara",
        "fetched": "2026-09-29",
        "title": "Oddelenia úradu"
      },
      "status": "draft",
      "origin": "adapted",
      "added": "2026-09-29",
      "contributor": "athelas64"
    },
    {
      "id": "doverny",
      "term": "dôverný",
      "forms": [
        "dôverná",
        "dôverné",
        "dôvernosť"
      ],
      "easy": "Dôverné znamená, že to ostane medzi vami a úradom.\nNikto iný sa to nedozvie.",
      "domain": "úrad",
      "note": "Web hovorí „Váš podnet je dôverný“ a „Pomoc je dôverná“, ale slovo nevysvetľuje. Vysvetlenie je návrh.",
      "source": {
        "name": "Úrad komisára pre osoby so zdravotným postihnutím",
        "url": "https://www.komisar.sk/cinnosti-komisara",
        "fetched": "2026-09-29",
        "title": "Potrebujete pomoc?"
      },
      "status": "draft",
      "origin": "human",
      "added": "2026-09-29",
      "contributor": "athelas64"
    },
    {
      "id": "osobne-udaje",
      "term": "osobné údaje",
      "forms": [
        "osobný údaj"
      ],
      "easy": "Osobné údaje sú informácie o vás.\nNapríklad meno alebo adresa.",
      "domain": "právo",
      "source": {
        "name": "Úrad komisára pre osoby so zdravotným postihnutím",
        "url": "https://www.komisar.sk/gdpr",
        "fetched": "2026-09-29",
        "title": "Ako chránime vaše údaje"
      },
      "status": "draft",
      "origin": "adapted",
      "added": "2026-09-29",
      "contributor": "athelas64"
    },
    {
      "id": "gdpr",
      "term": "GDPR",
      "forms": [
        "nariadenie GDPR"
      ],
      "easy": "GDPR je pravidlo Európskej únie.\nHovorí, ako sa musia chrániť osobné údaje.",
      "domain": "právo",
      "note": "Web skratku používa v štandardnom texte, v ľahkom ju obchádza. Vysvetlenie je návrh.",
      "source": {
        "name": "Úrad komisára pre osoby so zdravotným postihnutím",
        "url": "https://www.komisar.sk/gdpr",
        "fetched": "2026-09-29"
      },
      "status": "draft",
      "origin": "human",
      "added": "2026-09-29",
      "contributor": "athelas64"
    },
    {
      "id": "dohovor-osn-o-pravach-osob-so-zdravotnym-postihnutim",
      "term": "Dohovor OSN o právach osôb so zdravotným postihnutím",
      "forms": [
        "Dohovor OSN",
        "dohovor"
      ],
      "easy": "Dohovor je medzinárodná zmluva.\nV tomto dohovore je napísané, aké práva máte.\nSlovensko ho musí dodržiavať.\nCRPD je skratka pre tento dohovor.",
      "same_words": [
        "CRPD",
        "Dohovor o právach osôb so zdravotným postihnutím"
      ],
      "domain": "právo",
      "source": {
        "name": "Úrad komisára pre osoby so zdravotným postihnutím",
        "url": "https://www.komisar.sk/pre-verejnost",
        "fetched": "2026-09-29",
        "title": "Ako vám pomáhame"
      },
      "status": "draft",
      "origin": "adapted",
      "added": "2026-09-29",
      "contributor": "athelas64",
      "updated": "2026-09-29"
    },
    {
      "id": "monitorovanie",
      "term": "monitorovanie",
      "forms": [
        "monitoring",
        "monitorovacia návšteva",
        "monitorovacie návštevy"
      ],
      "easy": "Monitorovanie znamená, že úrad chodí do zariadení na návštevy.\nZisťuje, či sa tam dodržiavajú práva ľudí so zdravotným postihnutím.\nAk nájde problém, navrhne, čo treba zlepšiť.",
      "domain": "úrad",
      "source": {
        "name": "Úrad komisára pre osoby so zdravotným postihnutím",
        "url": "https://www.komisar.sk/monitoring",
        "fetched": "2026-09-29",
        "title": "Monitorovanie"
      },
      "status": "draft",
      "origin": "adapted",
      "added": "2026-09-29",
      "contributor": "athelas64"
    },
    {
      "id": "prieskum",
      "term": "prieskum",
      "forms": [
        "prieskumy"
      ],
      "easy": "Prieskum znamená, že úrad zisťuje, aký je skutočný stav.\nVýsledky pomáhajú veci zlepšovať.",
      "example": "Úrad zisťoval, či sa do volebnej miestnosti dostane aj človek na vozíku.",
      "domain": "úrad",
      "source": {
        "name": "Úrad komisára pre osoby so zdravotným postihnutím",
        "url": "https://www.komisar.sk/prieskumy",
        "fetched": "2026-09-29",
        "title": "Prieskumy"
      },
      "status": "draft",
      "origin": "adapted",
      "added": "2026-09-29",
      "contributor": "athelas64",
      "same_words": [
        "výskum",
        "výskumy"
      ],
      "updated": "2026-09-29"
    },
    {
      "id": "psychiatricke-zariadenie",
      "term": "psychiatrické zariadenie",
      "forms": [
        "psychiatrická nemocnica",
        "psychiatrická liečebňa",
        "psychiatria"
      ],
      "easy": "Psychiatrické zariadenia sú nemocnice pre ľudí s duševnými ťažkosťami.\nPacienti majú rovnaké práva ako všetci ostatní ľudia.",
      "domain": "zdravie",
      "source": {
        "name": "Úrad komisára pre osoby so zdravotným postihnutím",
        "url": "https://www.komisar.sk/monitoring-psych",
        "fetched": "2026-09-29",
        "title": "Návštevy v psychiatrických zariadeniach"
      },
      "status": "draft",
      "origin": "adapted",
      "added": "2026-09-29",
      "contributor": "athelas64"
    },
    {
      "id": "zariadenie-socialnych-sluzieb",
      "term": "zariadenie sociálnych služieb",
      "forms": [
        "zariadenia sociálnych služieb",
        "domov sociálnych služieb",
        "zariadenie pre seniorov"
      ],
      "easy": "V zariadeniach sociálnych služieb žijú ľudia so zdravotným postihnutím a seniori.\nNapríklad domov sociálnych služieb alebo zariadenie pre seniorov.",
      "same_words": [
        "DSS"
      ],
      "domain": "sociálne služby",
      "source": {
        "name": "Úrad komisára pre osoby so zdravotným postihnutím",
        "url": "https://www.komisar.sk/monitoring-zss",
        "fetched": "2026-09-29",
        "title": "Návštevy v domovoch sociálnych služieb"
      },
      "status": "draft",